{
  "schema_version": 1,
  "validation_run_id": "run_opaque",
  "corpus_id": "lf-corpus-v1",
  "corpus_hashes": {
    "es-single-digital": "aaaaaaaaaaaaaaaaaaaaaaaaaaaaaaaaaaaaaaaaaaaaaaaaaaaaaaaaaaaaaaaa"
  },
  "environment": {
    "hardware": "mac_m4",
    "operating_system": "macos_26",
    "rust": "1.97.1",
    "app_revision": "revision_opaque",
    "processor_revision": "processor_opaque"
  },
  "processing_route": "direct",
  "confidence": 0.99,
  "duration_ms": 10,
  "errors": [],
  "page_metrics": [
    {
      "document_id": "es-single-digital",
      "page_index": 0,
      "metric": "block_order",
      "numerator": 1,
      "denominator": 1,
      "value": 1.0
    }
  ],
  "status": "complete",
  "artifacts": {
    "environment_sha256": "bbbbbbbbbbbbbbbbbbbbbbbbbbbbbbbbbbbbbbbbbbbbbbbbbbbbbbbbbbbbbbbb",
    "metrics_sha256": "cccccccccccccccccccccccccccccccccccccccccccccccccccccccccccccccc",
    "summary_sha256": "dddddddddddddddddddddddddddddddddddddddddddddddddddddddddddddddd"
  }
}
